{
  "$schema": "https://json-schema.org/draft/2020-12/schema",
  "$id": "https://ellaz.fun/studio/fight/match.schema.json",
  "title": "Ellaz fight match file",
  "description": "The rules of a bout, all of them integers and all of them TICKS at tickRate. Nothing here is a duration in seconds and nothing here is a fraction: a float would have to be divided somewhere, and fixed.ts is the only file allowed to divide.",
  "type": "object",
  "required": [
    "id",
    "tickRate",
    "rounds",
    "hp",
    "knockScale",
    "liftScale",
    "hitZBand",
    "fallThreshold",
    "friction",
    "hitstopTicks",
    "shakeTicks",
    "attackCooldownTicks",
    "landedCooldownTicks",
    "hitsToKnockdown",
    "knockdownWindowTicks",
    "downTicks",
    "getupTicks",
    "invTicks",
    "koFadeTicks",
    "rematchAfterTicks"
  ],
  "additionalProperties": false,
  "properties": {
    "id": { "type": "string", "pattern": "^[a-z0-9-]+$", "description": "must equal the file's basename" },
    "tickRate": { "type": "integer", "exclusiveMinimum": 0, "description": "must equal TICK_RATE in core/types.ts" },
    "rounds": { "type": "integer", "exclusiveMinimum": 0 },
    "hp": { "type": "integer", "exclusiveMinimum": 0 },
    "knockScale": { "type": "integer", "exclusiveMinimum": 0, "description": "a knock/impulse vector is frame px; after the draw scale it is multiplied by this to become view px per second" },
    "liftScale": { "type": "integer", "exclusiveMinimum": 0, "description": "the vertical knock/impulse component's multiplier, frame px after the draw scale -> view px per second. Separate from knockScale because gravity (900 px/s^2) eats a small lift within a tick or two: at 10 the robot's authored dy -20 reached an apex of 0.9 view px (measured 2026-09-12), invisible; at 60 it is a 32 px hop" },
    "hitZBand": { "type": "integer", "exclusiveMinimum": 0, "description": "view px of z separation a hit still crosses. Must be comfortably above an ai's zTolerance (5), or an opponent that believes it has lined up the lane cannot reach; 12 is twice that plus slack, against a 158 px deep arena and a fighter about 34 view px wide." },
    "fallThreshold": { "type": "integer", "exclusiveMinimum": 0, "description": "accumulated `fall` points that knock a standing fighter down. 60 = three of the robot's swings (fall 20) or five of the teddy's (fall 12), which agrees with hitsToKnockdown for the heavier attack and asks more of the lighter one. It must stay ABOVE (hitsToKnockdown - 1) x the largest authored fall, or a fighter falls a hit early and hitsToKnockdown stops meaning anything." },
    "friction": { "type": "integer", "minimum": 2, "description": "a sliding fighter keeps (friction-1)/friction of its vx each tick, so the total slide is about vx x friction. 8 gives the robot's 512 FP knock ~16 view px of travel and its 409 FP walk ~13 px of skid - momentum, not ice. The minimum is 2 and not 0: fixed.ts would divide by zero, and 1 is an instant stop." },
    "hitstopTicks": { "type": "integer", "minimum": 0, "description": "everyone freezes this long when a hit lands" },
    "shakeTicks": { "type": "integer", "minimum": 0, "description": "view only" },
    "attackCooldownTicks": { "type": "integer", "minimum": 0, "description": "ticks from one attack's start before the next may start; 0 restores cancelFrom-only mashing" },
    "landedCooldownTicks": { "type": "integer", "minimum": 0, "description": "what the attacker's recovery becomes the tick its swing LANDS. 0 hands the next swing to the moves file's cancelFrom, so hits chain (swing-hit-swing); a swing that touches nothing keeps attackCooldownTicks. Measured 2026-09-12: with the recovery paid on every swing, a mashing robot's landed swings were never closer than 60 ticks at any cooldown 15..60, and lowering attackCooldownTicks below 60 let a standing mash take 0 hits again - so the chain is a refund on a hit, not a shorter recovery." },
    "hitsToKnockdown": { "type": "integer", "exclusiveMinimum": 0 },
    "knockdownWindowTicks": { "type": "integer", "minimum": 0, "description": "how long recent hits stay recent" },
    "downTicks": { "type": "integer", "minimum": 0 },
    "getupTicks": { "type": "integer", "minimum": 0 },
    "invTicks": { "type": "integer", "minimum": 0, "description": "invulnerability after getting up" },
    "koFadeTicks": { "type": "integer", "minimum": 0 },
    "rematchAfterTicks": { "type": "integer", "minimum": 0 }
  }
}
